Long-Life Room-Temperature Sodium–Sulfur Batteries by Virtue of Transition-Metal-Nanocluster–Sulfur Interactions,"© 2019 Wiley-VCH Verlag GmbH & Co. KGaA, Weinheim Room-temperature sodium–sulfur (RT-Na/S) batteries hold significant promise for large-scale application because of low cost of both sodium and sulfur. However, the dissolution of polysulfides into the electrolyte limits practical application. Now, the design and testing of a new class of sulfur hosts as transition-metal (Fe, Cu, and Ni) nanoclusters (ca. 1.2 nm) wreathed on hollow carbon nanospheres (S@M-HC) for RT-Na/S batteries is reported. A chemical couple between the metal nanoclusters and sulfur is hypothesized to assist in immobilization of sulfur and to enhance conductivity and activity. S@Fe-HC exhibited an unprecedented reversible capacity of 394 mAh g −1 despite 1000 cycles at 100 mA g −1 , together with a rate capability of 220 mAh g −1 at a high current density of 5 A g −1 . DFT calculations underscore that these metal nanoclusters serve as electrocatalysts to rapidly reduce Na 2 S 4 into short-chain sulfides and thereby obviate the shuttle effect.",Angewandte Chemie - International Edition,10.1002/anie.201811080
Sulfur-Based Electrodes that Function via Multielectron Reactions for Room-Temperature Sodium-Ion Storage Schwefel-basierte Elektroden mit Mehrelektronenreaktionen für Raumtemperatur-Natriumionenspeicherung,"© 2019 Wiley-VCH Verlag GmbH & Co. KGaA, Weinheim.Emerging rechargeable sodium-ion storage systems—sodium-ion and room-temperature sodium–sulfur (RT-NaS) batteries—are gaining extensive research interest as low-cost options for large-scale energy-storage applications. Owing to their abundance, easy accessibility, and unique physical and chemical properties, sulfur-based materials, in particular metal sulfides (MSx) and elemental sulfur (S), are currently regarded as promising electrode candidates for Na-storage technologies with high capacity and excellent redox reversibility based on multielectron conversion reactions. Here, we present current understanding of Na-storage mechanisms of the S-based electrode materials. Recent progress and strategies for improving electronic conductivity and tolerating volume variations of the MSx anodes in Na-ion batteries are reviewed. In addition, current advances on S cathodes in RT-NaS batteries are presented. We outline a novel emerging concept of integrating MSx electrocatalysts into conventional carbonaceous matrices as effective polarized S hosts in RT-NaS batteries as well. This comprehensive progress report could provide guidance for research toward the development of S-based materials for the future Na-storage techniques.",Advanced Materials,10.1002/ANGE.201902552
Effect of eutectic accelerator in selenium-doped sulfurized polyacrylonitrile for high performance room temperature sodium-sulfur batteries,"© 2019 The Royal Society of Chemistry.Sulfurized polyacrylonitrile is a suitable cathode candidate for room temperature sodium-sulfur batteries. However, its limited reactivity results in low utilization of active materials, limited rate capability and poor cycling performance especially in ether electrolyte. Here, we demonstrate the effect of using selenium as a eutectic accelerator in sulfurized polyacrylonitrile in which a small amount of selenium is easily distributed at the molecular level and leads to significant improvement of reaction kinetics. As a result, the designed Se0.08S0.92@pPAN cathode exhibits superior rate and cycle performance as well as compatibility with both ether and carbonate electrolytes, delivers capacities of 1214 and 767 mA h g-1 at 0.1 and 3 A g-1 respectively, and maintains a good specific capacity of 770 mA h g-1 at 0.4 A g-1 over 500 cycles (0.045% decay per cycle) in carbonate electrolyte with nearly 100% coulombic efficiency. Furthermore, self-discharge tests reveal diminished soluble sodium polysulfides owing to the fast redox conversion enabled by Se-doping.",Journal of Materials Chemistry A,10.1039/c9ta02831e
Iodine-doped sulfurized polyacrylonitrile with enhanced electrochemical performance for room-temperature sodium/potassium sulfur batteries,"© The Royal Society of Chemistry 2019.Iodine-doped sulfurized polyacrylonitrile (I-S@pPAN) is reported for room-temperature sodium sulfur (RT-Na/S) and potassium sulfur (RT-K/S) batteries operated in ester-based electrolytes. It delivers an unprecedented capacity of 994 mA h g-1 at 2C (3350 mA g-1) for the RT-Na/S battery, whilst a reversible capacity of 947 mA h g-1 at 0.1C for the RT-K/S battery.",Chemical Communications,10.1039/c9cc01612k
Untying thioether bond structures enabled by “voltage-scissors” for stable room temperature sodium-sulfur batteries,"© The Royal Society of Chemistry.A steady sulfur cathode is central to realizing stable room temperature sodium-sulfur (RT Na-S) batteries. Here, sulfur atoms are incorporated into carbon to form thioether bond functionalized carbon (SC) as a cathode material for sodium storage, which is capable of the complete elimination or great suppression of the shuttle effect of soluble poly-sulfides by the generation of insoluble sulfides in RT Na-S batteries using an ordinary carbonate electrolyte. This thioether bond structure (C-S-C) in sulfur-doped carbon can be disassembled by the assistance of “voltage-scissors” in the low voltage range of 0.01-0.50 V vs. Na/Na+. The small sulfur species derived from the thioether bond structure react with the sodium anode to form insoluble sulfides. Moreover, the insoluble sulfides Na2S2 and Na2S are confined in the carbon defects induced by the cleaved sulfur to prevent them from degrading the long-chain poly-sulfides. The distinctive electrochemical performance of SC enriches our understanding of the sulfur cathode, and could provide novel insights for constructing stable sulfur cathode materials for specific energy storage devices.",Nanoscale,10.1039/c9nr01637f
Fluoroethylene carbonate as an additive in a carbonates-based electrolyte for enhancing the specific capacity of room-temperature sodium-sulfur cell,"© 2018 Elsevier B.V.Room-temperature sodium‑sulfur (RT Na-S) battery is a promising candidate for large-scale energy storage applications due to its high theoretical specific energy, low cost, and environmental benefits. Here the effect of fluoroethylene carbonate (FEC) as an additive in 1.0 M NaClO4-ethylene carbonate/propylene carbonate (EC/PC, V/V = 1/1) electrolyte was verified in RT Na-S battery with a high-surface-area carbon/sulfur composite (YP50F/S) as the cathode. Using 1.0 M NaClO4-EC/PC electrolyte containing 5 wt% FEC, the YP50F/S electrode can deliver a reversible capacity of up to 1651 mA h g−1 at 0.1C. When 5 wt% FEC-added electrolyte is used, X-ray photoelectron spectroscopy (XPS) analysis of the electrode surface clearly indicates a more effective solid electrolyte interface (SEI), a more thorough transformation between S and Na2S, and a more obvious redox reaction between sulfur oxides during the first discharge-charge processes. We further confirm that 5 wt% FEC can also be employed for another activated carbon material (XFP01), therefore, our work may provide a new insight for the development of RT Na-S battery.",Journal of Electroanalytical Chemistry,10.1016/j.jelechem.2018.11.021
"A theoretical study on the stability and ionic conductivity of the Na11M2PS12 (M = Sn, Ge) superionic conductors","© 2018 Elsevier B.V.The search for next-generation solid-state superionic conductors has attracted significant attention. Among Na superionic conductors, Na11Sn2PS12 has been reported to have a room temperature ionic conductivity of 1.4 mS/cm. In this study, we employ density functional theory to study the stability of Na11Sn2PS12 and further explore the substitution of Sn with Ge. Our results indicate that Na11Ge2PS12 is more stable than Na11Sn2PS12. Furthermore, substituting Sn with Ge increases the band gap, improves the room temperature ionic conductivity by a factor of 2, and lowers the activation energy of Na hopping. Statistical analysis suggests that Na11Ge2PS12 has a faster diffusion along the ab-plane compared to the c-axis. The Na diffusion in Na11Ge2PS12 appears to occur with two different mechanisms depending on temperature: 1) an ion hopping process at lower temperatures (<800 K); 2) a fluid-like distribution of Na ions at higher temperatures (>1000 K). The computations suggest that Na11Ge2PS12 is a promising candidate as a solid Na electrolyte due to its high room temperature ionic conductivity and phase stability. In light of these simulation results, we expect to stimulate further experimental studies on Na11Ge2PS12.",Journal of Power Sources,10.1016/j.jpowsour.2018.10.077
Atomic cobalt as an efficient electrocatalyst in sulfur cathodes for superior room-temperature sodium-sulfur batteries,"© 2018, The Author(s).The low-cost room-temperature sodium-sulfur battery system is arousing extensive interest owing to its promise for large-scale applications. Although significant efforts have been made, resolving low sulfur reaction activity and severe polysulfide dissolution remains challenging. Here, a sulfur host comprised of atomic cobalt-decorated hollow carbon nanospheres is synthesized to enhance sulfur reactivity and to electrocatalytically reduce polysulfide into the final product, sodium sulfide. The constructed sulfur cathode delivers an initial reversible capacity of 1081 mA h g−1 with 64.7% sulfur utilization rate; significantly, the cell retained a high reversible capacity of 508 mA h g−1 at 100 mA g−1 after 600 cycles. An excellent rate capability is achieved with an average capacity of 220.3 mA h g−1 at the high current density of 5 A g−1. Moreover, the electrocatalytic effects of atomic cobalt are clearly evidenced by operando Raman spectroscopy, synchrotron X-ray diffraction, and density functional theory.",Nature Communications,10.1038/s41467-018-06144-x
A room-temperature sodium–sulfur battery with high capacity and stable cycling performance,"© 2018, The Author(s).High-temperature sodium–sulfur batteries operating at 300–350 °C have been commercially applied for large-scale energy storage and conversion. However, the safety concerns greatly inhibit their widespread adoption. Herein, we report a room-temperature sodium–sulfur battery with high electrochemical performances and enhanced safety by employing a “cocktail optimized” electrolyte system, containing propylene carbonate and fluoroethylene carbonate as co-solvents, highly concentrated sodium salt, and indium triiodide as an additive. As verified by first-principle calculation and experimental characterization, the fluoroethylene carbonate solvent and high salt concentration not only dramatically reduce the solubility of sodium polysulfides, but also construct a robust solid-electrolyte interface on the sodium anode upon cycling. Indium triiodide as redox mediator simultaneously increases the kinetic transformation of sodium sulfide on the cathode and forms a passivating indium layer on the anode to prevent it from polysulfide corrosion. The as-developed sodium–sulfur batteries deliver high capacity and long cycling stability.",Nature Communications,10.1038/s41467-018-06443-3
Improving the Stability of an RT-NaS Battery via In Situ Electrochemical Formation of Protective SEI on a Sulfur–Carbon Composite Cathode,"© 2018 WILEY-VCH Verlag GmbH & Co. KGaA, WeinheimThe room temperature sodium sulfur battery (RT-NaS) has attracted considerable attention as a next-generation energy storage system due to its low cost and high specific energy and the abundance of sodium and sulfur. However, the sulfur-based cathode in RT-NaS always undergoes dissolution of polysulfides during the cycle, which limits the utilization of active material and the stability of the RT-NaS. In this study, the authors report an economical and simple method to suppress the dissolution of polysulfides by forming an artificial protective solid electrolyte interphase (SEI) on the cathode surface using an in situ electrochemical treatment with a fluoroethylene carbonate (FEC) electrolyte additive. The artificially formed SEI has a thickness of ≈20 nm and contains fluoride anions that improve electrical conductivity and mechanical stability. The RT-NaS full cell with the sulfur–carbon cathode and protective SEI exhibits a 0.1 VNa+/Na lower electrochemical polarization for desodiation, and SEI and electrical resistances that are 23% and 45% lower, respectively, than those of untreated NaS. These improvements lead to a capacity increase of ≈120% (270 to 590 mAh g−1 at the 50th cycle) and a high Coloumbic efficiency of 99.5% in the high-rate cyclability test of the 2 C rate over 200 cycles.",Advanced Sustainable Systems,10.1002/adsu.201800076
Carbon hollow nanobubbles on porous carbon nanofibers: An ideal host for high-performance sodium-sulfur batteries and hydrogen storage,"© 2018One-dimensional (1D) carbon nanostructures have been intensively investigated because of their intriguing features and great potential for practical application in various fields. This paper reports the controllable fabrication of carbon hollow nanobubbles on porous carbon nanofibers (CHNBs@PCNFs) through a general electrospinning strategy, with metal azides serving as both a bubbling and a porogen reagent. The strong repulsive forces resulting from the intense release of N2 from the decomposition of metal azides upon carbonization leads to the uniform formation of porous carbon nanofibers (PCNFs), which could be facile tuned by heating rates and the amount of the bubbling reagent, simultaneously constructed with carbon hollow nanobubbles (CHNBs) on the surface. Density functional theory calculations reveal the strong interactions between terminal Na atoms in sodium polysulfides and N and O atoms doped into CHNBs@PCNFs, which could effectively alleviate the shuttle effect of Na-S batteries via adsorbing and trapping polysulfides. With strong adsorption capability of sodium polysulfides and high electrical conductivity, these CHNBs@PCNFs are demonstrated to be an ideal sulfur host in room-temperature sodium-sulfur batteries, which delivers a high reversible capacity of 256 mA h g−1 (specific energy density 384 W h kg−1) with a low decay rate of 0.044% per cycle at 2 C-rate. When CHNBs@PCNFs used as functional supports for MgH2 nanoparticles, a significantly enhanced hydrogen storage performance was achieved. The present work represents a critically important step in advancing the electrospinning technique for generating 1D carbon nanostructures in a facile and universal manner.",Energy Storage Materials,10.1016/j.ensm.2018.05.008
Remedies of capacity fading in room-temperature sodium-sulfur batteries,"© 2018 Elsevier B.V.Liquid-electrolyte sodium-sulfur battery operated at room temperature is encountering challenges brought by the complex sulfur redox reactions, including (i) the dissolved polysulfide intermediates trigger serious side reactions on Na anode surface; (ii) the short-chain sulfide precipitation exhibits sluggish kinetics and the sulfur utilization is generally below 50% with unclear reasons. In this work, employing an ion selective polybenzimidazole-based separator we successfully suppress the polysulfide corrosion on the Na anode, which allows the investigation of the precipitation reaction. Combining DFT calculation and characterization techniques, we determine Na2S2 particles as the final discharge product and reveal that Na2S2 passivation is the predominant attributes of large polarization and capacity fading. To address these issues, we present the use of a bifunctional NaI-P2S5 based electrolyte additive, which (i) improves the Na2S2 precipitation kinetics by forming soluble Na2S2-P2S5 complex and (ii) promotes the dissolution of Na2S2 by the chemical mediation of I−/ I3−. As a result, a much improved capacity retention (92.9% for 50 cycles at 0.2C) is attained, which sheds light on enabling the stable operation of sodium-sulfur batteries via combining advanced separator and electrolyte engineering strategies.",Journal of Power Sources,10.1016/j.jpowsour.2018.06.056
An Electrospun Nanofiber Membrane as Gel-Based Electrolyte for Room-Temperature Sodium–Sulfur Batteries,"© 2018 Wiley-VCH Verlag GmbH & Co. KGaA, WeinheimWe report on the synthesis and characterization of an electrospun gel polymer electrolyte (GPE) membrane based on polyacrylonitrile nanofibers (PAN) swollen in a polyethylene glycol dimethyl ether/Na-salt electrolyte solution, for application in room temperature sodium–sulfur (Na–S) batteries. The membranes show a high ionic conductivity, wide electrochemical stability window, and good thermal stability. We demonstrate the performance of the membrane in an Na–S cell using a sulfur–carbon nanotubes composite cathode and Na metal as anode. Our results show that the GPE membrane stabilizes the Na metal anode resulting in stable cycling behavior. The capacity of the Na–S cell, using the GPE membrane and operating at room temperature, is approximately 500 mAh g−1 over 40 cycles. The selected electrolyte configuration also provides improved safety by replacing the highly reactive sodium perchlorate (NaClO4) salt previously used in literature. All these benefits make the gel-polymer electrolyte membrane a very promising system for application in room-temperature sodium and sodium–sulfur batteries.",Energy Technology,10.1002/ente.201800170
Self-Assembling Hollow Carbon Nanobeads into Double-Shell Microspheres as a Hierarchical Sulfur Host for Sustainable Room-Temperature Sodium-Sulfur Batteries,"© 2018 American Chemical Society.We report the use of passion fruit-like double-carbon-shell porous carbon microspheres (PCMs) as the sulfur substrate in room-temperature sodium-sulfur batteries. The PCMs are covered by microsized carbon shells on the outside and consisted of carbon nanobeads with hollow structure inside, leading to a unique multidimensional scaling double-carbon-shell structure with high electronic conductivity and strengthened mechanical properties. Sulfur is filled inside the PCMs (PCMs-S) and protected by the unique double-carbon-shell, which means the subsequently generated intermediate sodium polysulfide species cannot be exposed to the electrolyte directly and well protected inside. In addition, the inner interconnected porous structure provides room for the volume expansion of sulfur during discharge processes. It is found that the PCMs-S with a 63.6% initial Coulombic efficiency contributed to the 290 mA h g-1 at the current density of 100 mA g-1 after 350 cycles. More importantly, PCMs-S exhibited good rate performance with a capacity of 113 and 56 mA h g-1 at the current densities of 1000 and 2000 mA g-1, respectively.",ACS Applied Materials and Interfaces,10.1021/acsami.8b03850
Effect of organic solvent addition on electrochemical properties of ionic liquid based Na+ conducting gel electrolytes,"© 2017 Elsevier B.V.A novel sodium ion conducting gel polymer electrolyte comprising room temperature ionic liquid, 1-ethyl 3-methyl imidazolium trifluoro-methane sulfonate (EMITf) incorporated with ethylene carbonate and propylene carbonate and its solution with sodium trifluoromethane sulfonate (NaTf) entrapped in poly(vinylidinefluoride-co-hexfluoropropylene) (PVdF-HFP) is prepared using solution cast technique. The gel electrolyte is obtained in the form of free-standing transparent film. The gel electrolyte offers electrical conductivity of ∼ 10− 3 S cm− 1 at ∼ 30 °C with good mechanical, thermal and electrochemical stability window. The electrical conductivity is measured as a function of temperature and found to be consistent with Vogel-Tamman-Fulcher (VTF) relationship in the temperature range from 30 °C to 75 °C. Sodium ion conduction in the gel electrolyte film is confirmed from cyclic voltammetry and transport number measurements. The value of the sodium ion transport number of the ionic liquid based gel electrolyte is ∼ 0.19. The sodium sulfur battery with the gel electrolytes delivers the first discharge capacity of 267 mAh g− 1 sulfur and then it decreases with repeated charge–discharge cycles.",Solid State Ionics,10.1016/j.ssi.2017.09.006
Sodium–Sulfur Flow Battery for Low-Cost Electrical Storage,"© 2018 WILEY-VCH Verlag GmbH & Co. KGaA, WeinheimA new sodium–sulfur (Na–S) flow battery utilizing molten sodium metal and flowable sulfur-based suspension as electrodes is demonstrated and analyzed for the first time. Unlike the conventional flow battery and the high-temperature Na–S battery, the proposed flow battery system decouples the energy and power thermal management by operating at different temperatures for the storage tank (near room temperature) and the power stack (100–150 °C). The new Na–S flow battery offers several advantages such as easy preparation and integration of the electrode, low energy efficiency loss due to temperature maintenance, great tolerance of the volume change of the metal anode, and efficient utilization of sulfur. The Na–S flow battery has an estimated system cost in the range of $50–100 kWh−1 which is very competitive for grid-scale energy storage applications.",Advanced Energy Materials,10.1002/aenm.201701991
New Strategy for Polysulfide Protection Based on Atomic Layer Deposition of TiO2 onto Ferroelectric-Encapsulated Cathode: Toward Ultrastable Free-Standing Room Temperature Sodium–Sulfur Batteries,"© 2018 WILEY-VCH Verlag GmbH & Co. KGaA, WeinheimThe room temperature (RT) sodium–sulfur batteries (Na–S) hold great promise for practical applications including energy storage and conversion due to high energy density, long lifespan, and low cost, as well based on the abundant reserves of both sodium metal and sulfur. Herein, freestanding (C/S/BaTiO3)@TiO2 (CSB@TiO2) electrode with only ≈3 wt% of BaTiO3 additive and ≈4 nm thickness of amorphous TiO2 atomic layer deposition protective layer is rational designed, and first used for RT Na–S batteries. Results show that such cathode material exhibits high rate capability and excellent durability compared with pure C/S and C/S/BaTiO3 electrodes. Notably, this CSB@TiO2 electrode performs a discharge capacity of 524.8 and 382 mA h g−1 after 1400 cycles at 1 A g−1 and 3000 cycles at 2 A g−1, respectively. Such superior electrochemical performance is mainly attributed from the “BaTiO3-C-TiO2” synergetic structure within the matrix, which enables effectively inhibiting the shuttle effect, restraining the volumetric variation and stabilizing the ionic transport interface.",Advanced Functional Materials,10.1002/adfm.201705537
Room-Temperature Sodium-Sulfur Batteries: A Comprehensive Review on Research Progress and Cell Chemistry,"© 2017 WILEY-VCH Verlag GmbH & Co. KGaA, WeinheimRoom temperature sodium-sulfur (RT-Na/S) batteries have recently regained a great deal of attention due to their high theoretical energy density and low cost, which make them promising candidates for application in large-scale energy storage, especially in stationary energy storage, such as with electrical grids. Research on this system is currently in its infancy, and it is encountering severe challenges in terms of low electroactivity, limited cycle life, and serious self-charging. Moreover, the reaction mechanism of S with Na ions varies with the electrolyte that is applied, and is very complicated and hard to detect due to the multi-step reactions and the formation of various polysulfides. Therefore, understanding the chemistry and optimizing the nanostructure of electrodes for RT-Na/S batteries are critical for their advancement and practical application in the future. In the present review, the electrochemical reactions between Na and S are reviewed, as well as recent progress on the crucial cathode materials. Furthermore, attention also is paid to electrolytes, separators, and cell configuration. Additionally, current challenges and future perspectives for the RT-Na/S batteries are discussed, and potential research directions toward improving RT-Na/S cells are proposed at the end.",Advanced Energy Materials,10.1002/aenm.201602829
Progress and prospects of sodium-sulfur batteries: A review,"© 2017This paper presents a review of the state of technology of sodium-sulfur batteries suitable for application in energy storage requirements such as load leveling; emergency power supplies and uninterruptible power supply. The review focuses on the progress, prospects and challenges of sodium-sulfur batteries operating at high temperature (~ 300 °C). This paper also includes the recent development and progress of room temperature sodium-sulfur batteries.",Solid State Ionics,10.1016/j.ssi.2017.10.004
