Lychee seed-derived microporous carbon for high-performance sodium-sulfur batteries,"© 2022 Elsevier LtdSodium-sulfur (Na–S) batteries are regarded as one of the promising next-generation energy storage systems; while being more cost-effective than lithium-sulfur batteries, Na–S batteries also suffer from the shuttle effect. Different strategies to tackle the long-chain polysulfide product shuttling issue have been proposed, mainly focusing on sulfur product confinement with costly materials and complex methods. Seeking high-performance and low-cost electrode material precursors is of great importance to promoting Na–S battery applications. We present a high specific surface area microporous carbon framework synthesized from degradable biowaste, namely lychee seeds, with a facile room-temperature etching process. Unlike the traditional dissolution-precipitation mechanism, a quasi-solid-state route takes place with the help of micropore (0.48 nm) confinement, preventing the formation of long-chain polysulfides for excellent electrochemical performance. The obtained Na–S battery exhibits an outstanding initial reversible discharge specific capacity of 1395 mAh g−1 at 0.2C and still maintains a high capacity of 518 mAh g−1 after 500 cycles at 1.0C. The lychee seed-derived microporous carbon provides insights into sustainable and scalable host fabrication for high-performance sulfur-based batteries.",Carbon,10.1016/j.carbon.2022.09.075
Oxygen vacancy-mediated amorphous GeOx assisted polysulfide redox kinetics for room-temperature sodium-sulfur batteries,"© 2022 Elsevier Inc.The practical applications of room-temperature sodium-sulfur (RT Na-S) batteries have been greatly hindered by the natural sluggish reaction kinetics of sulfur and the shuttle effect of sodium polysulfide (NaPSs). Herein, oxygen vacancy (OV)-mediated amorphous GeOx/nitrogen doped carbon (donated as GeOx/NC) composites were well designed as sulfur hosts for RT Na–S batteries. Experimental and density functional theory studies show that the introduction of oxygen vacancies on GeOx/NC can effectively immobilize polysulfides and accelerate the redox kinetics of polysulfides. Meanwhile, the micro-and mesoporous framework, acting as a reactor for storing active S, is conducive to alleviating the expansion of S during the charging/discharging process. Consequently, the S@GeOx/NC cathode affords a reversible capacity of 1017 mA h g−1 at 0.1 A g−1 after 100 cycles, outstanding rate capability of 333 mA h g−1 at 10.0 A g−1 and long lifespan cyclability of 385 mAh g−1 at 1 A g−1 after 1200 cycles. This work furnishes a new way for the rational design of metal oxides with oxygen vacancies and boosts the application for RT Na-S batteries.",Journal of Colloid and Interface Science,10.1016/j.jcis.2022.09.071
Ce(NO3)4: A dual-functional electrolyte additive for room-temperature sodium-sulfur batteries,"© 2022 Elsevier B.V.Room-temperature sodium-sulfur batteries face enormous challenges in the coulombic efficiency, capacity retention, and rate performance, which are seriously related to the solid electrolyte interface film, the shuttle effect of polysulfide, and the sodium-sulfur reaction kinetics. Adjusting the electrolyte composition by additives can significantly improve the battery performance and is attracting tremendous attention. However, the reported additives mainly focus on one of the two electrodes. It is still a considerable challenge to balance both aspects. This work proposes a novel dual-functional additive, Ce(NO3)4, and studies its comprehensive influence on the battery performance by X-ray diffraction (XRD), Fourier transforms infrared spectroscopy (FTIR), X-ray photoelectron spectroscopy (XPS), scanning electron microscope (SEM), energy-dispersive X-ray spectroscopy (EDS), and electrochemical techniques. The results show that Ce(NO3)4 generates NaCeO2 and NaNO3 to deposit on the Na surface. This inert deposition layer inhibits the side reactions between Na and polysulfides and optimizes the Na dissolution/deposition process, thereby improving the cycle stability of the battery. In addition, Ce4+ has a strong adsorption effect on capturing and evenly depositing polysulfides on the S cathode to inhibit the shuttle effect. In short, the Ce(NO3)4 additive plays a dual function of protecting the Na anode and optimizing the S cathode reaction.",Chemical Engineering Journal,10.1016/j.cej.2022.137978
An extraordinary Na-S battery enabled by a carbon nanosheet host loaded with Fe-accelerator and TiO2-inhibitor,"© 2022 Elsevier B.V.The inexpensive room-temperature sodium-sulfur (RT Na-S) battery has attracted extensive attention due to its various potential application but is still suffering from the low utilization of sulfur, the shuttle effect and the sluggish reaction activity of sodium polysulfides (SPSs). In this work, a TiO2/sulfur/atomic-iron loaded carbon nanosheet cathode is designed for high performance RT Na-S battery. When the atomic iron exists, a much higher electrochemical activity of sulfur was obtained, indicating the atomic iron can accelerate the conversion of SPSs. Furthermore, the TiO2 layer can inhibit the shuttle effect of SPSs and the side-reaction between the intermediates and carbonate electrolyte. As a result, the constructed sulfur cathode exhibits a high reversible capacity (569.9 mAh g−1 with an initial coulombic efficiency of 57.57%) at 0.1 A g−1 and outstanding cycling performance (507 mAh g−1 after 50 cycles). This work provides a new strategy for preparing high performance cathode materials for RT Na-S battery.",Applied Surface Science,10.1016/j.apsusc.2022.154496
An electrochemically stable homogeneous glassy electrolyte formed at room temperature for all-solid-state sodium batteries,"© 2022, The Author(s).All-solid-state sodium batteries (ASSSBs) are promising candidates for grid-scale energy storage. However, there are no commercialized ASSSBs yet, in part due to the lack of a low-cost, simple-to-fabricate solid electrolyte (SE) with electrochemical stability towards Na metal. In this work, we report a family of oxysulfide glass SEs (Na3PS4−xOx, where 0 < x ≤ 0.60) that not only exhibit the highest critical current density among all Na-ion conducting sulfide-based SEs, but also enable high-performance ambient-temperature sodium-sulfur batteries. By forming bridging oxygen units, the Na3PS4−xOx SEs undergo pressure-induced sintering at room temperature, resulting in a fully homogeneous glass structure with robust mechanical properties. Furthermore, the self-passivating solid electrolyte interphase at the Na|SE interface is critical for interface stabilization and reversible Na plating and stripping. The new structural and compositional design strategies presented here provide a new paradigm in the development of safe, low-cost, energy-dense, and long-lifetime ASSSBs.",Nature Communications,10.1038/s41467-022-30517-y
Effect of specifically-adsorbed polysulfides on the electron transfer kinetics of sodium metal anodes,"© 2022 Science Press and Dalian Institute of Chemical Physics, Chinese Academy of SciencesRoom-temperature sodium-sulfur (RT Na-S) batteries hold great promise for large-scale energy storage applications owing to the high energy density and earth-abundance of Na and S. However, the dissolution and migration of sodium polysulfides, uncontrollable Na dendrite growth, and the lack of studies on Na electrodeposition kinetics have hindered the development of these batteries. Herein, we reveal the mechanism of sodium polysulfides on the Na plating/stripping kinetics using a three-electrode system. First, the kinetic behavior deviates from the commonly supposed Butler–Volmer model, which is well described by the Marcus model. In addition, the specific adsorption of polysulfides on the sodium electrode surface is a key factor influencing the kinetics. Higher-order polysulfides (S82− and S62−) exhibit distinct specific adsorption behaviors because of their high adsorption energies compared to lower-order polysulfides (S42− and S22−). The electrostatic effect caused by specific adsorption can accelerate the kinetics, whereas the blocking effect can slow the kinetics. Thus, this competitive relationship enables low concentrations of high-order polysulfides to stimulate kinetics. This implies that a weak shuttle effect is beneficial for obtaining a stable Na deposition in RT Na-S batteries. An in-depth understanding of the Na electrodeposition kinetics provides beneficial clues for future metal sodium/electrolyte interface designs.",Journal of Energy Chemistry,10.1016/j.jechem.2022.07.008
A highly-efficient electrocatalyst for room temperature sodium-sulfur batteries: assembled nitrogen-doped hollow porous carbon spheres decorated with ultrafine α-MoC1-x nanoparticles,"© 2022 Elsevier B.V.While room-temperature sodium-sulfur (RT Na-S) battery is considered one of the most promising technologies for next-generation energy storage, its commoditization is constrained by the shuttling and sluggish redox kinetics of the sulfur electrode. Herein, a honeycomb-like sulfur electrocatalyst with ultrafine α-MoC1-x nanoparticles uniformly distributed on nitrogen-doped hollow porous carbon spheres (MoC@NHC) is designed and synthesized. Prepared through a template-assisted strategy followed by a self-assembly and pyrolysis process, the interconnected hollow porous structure of MoC@NHC provides not only a microenvironment for confinement of sodium polysulfides (NaPSs) but also sufficient free space for accommodation of volume change during electrochemical cycling. Moreover, the polar α-MoC1-x nanoparticles coupled with N-doped carbon provides strong affinity to NaPSs and promote catalytic conversion of NaPSs, as confirmed by experimental results and theoretical calculations. Owing to the physical and chemical dual confinement effect and the fast conversion kinetics of NaPSs, the S/MoC@NHC-15 cathode demonstrates good rate performances (351.8 mAh g−1 at 10 C) and outstanding cyclability (retaining capacities of 418.4 and 312.6 mAh g−1 after 1000 cycles at 1 and 5 C, respectively). This study introduces a simple and effective method for fabrication of S/MoC@NHC cathode materials for high-performance RT Na-S batteries.",Energy Storage Materials,10.1016/j.ensm.2022.07.028
Surface Film Formation from Sodium Polysulfide Decomposition on Sodium-Metal Anode Surface,"© 2022 American Chemical Society. All rights reserved.Room-temperature sodium-sulfur batteries are being considered as an alternative next generation of energy storage devices to replace lithium-sulfur batteries due to lower costs of Na metal while keeping a high theoretical capacity. A comprehensive understanding of polysulfide decomposition mechanisms and passivation film formation on the Na-metal surface has challenged the development of this metal-sulfur chemistry. Here, using first-principles modeling, we study the adsorption of sodium polysulfide (NaPS) molecules on the Na-metal surface and investigate the Na2S film formation from soluble NaPS decomposition in the presence of different electrolyte solvents (i.e., EC, PC, and EC/PC mixture). We find that NaPS molecules strongly interact with the Na-metal surface via Na-S bonds, leading to charge migration from the metal to the adsorbates. Such strong adsorption precedes a complete spontaneous electron-transfer decomposition of NaPS to form an amorphous Na2S film on the anode surface. The reduction reaction mechanisms are identified for each electrolyte, suggesting that polysulfides are completely decomposed in a short time. The energetic properties suggest that the first and second steps in the reaction of NaPS decomposition in the mixture solvent are thermodynamically uphill. The decomposed S atoms from NaPS can insert into the Na slab, leading to Na2S formation. The decomposition of multiple NaPS molecules reveals that the reduction of further NaPS on the surface after the first one is sluggish and incomplete because of the passivating nature of the nascent Na2S film, while NaPS far from the surface remains in the electrolyte phase forming a soluble NaPS cluster dissolved in the solvent.",Journal of Physical Chemistry C,10.1021/acs.jpcc.2c05223
Robust Room-Temperature Sodium-Sulfur Batteries Enabled by a Sandwich-Structured MXene@C/Polyolefin/MXene@C Dual-functional Separator,"© 2022 Wiley-VCH GmbH.Room-temperature sodium-sulfur (RT-Na-S) batteries are attracting increased attention due to their high theoretical energy density and low-cost. However, the traditional RT-Na-S batteries assembled with glass fiber (GF) separators are still hindered by the polysulfide shuttle effect and sodium dendrite growth, limiting the battery's capacity and cycling stability. Here, a facile and effective method toward commercial polyolefin separators for constructing stable RT-Na-S batteries is presented. By coating commercial polypropylene membrane with core-shell structured MXene@C nanosheets, a powerful dual-functional separator with improved electrolyte wettability that can inhibit polysulfide migration and induce uniform sodium disposition is developed. More importantly, the modified separator can also accelerate the conversion kinetics of sodium polysulfides. Benefiting from these characteristics, the as-prepared RT-Na-S battery exhibits a remarkably enhanced capacity (1159 mAh g-1 at 0.2 C) and excellent cycling performance (95.8% of capacity retention after 650 cycles at 0.5 C). This study opens a promising avenue for the development of high-performance Na-S batteries.",Small,10.1002/smll.202106983
Chitin-Derived Heteroatom-Doped Porous Carbon for High-Performance Room-Temperature Na-S Batteries,"© 2022 American Chemical Society. All rights reserved.Porous carbon derived from biomass is considered as a promising active electrode material for the next-generation energy storage systems. Herein, carbon particles with a hierarchical structure are fabricated from chitin through a facile pyrolysis/activation process, which is loaded with sulfur (S) as the cathode material in a room-temperature sodium-sulfur (RT Na-S) battery. Owing to the large specific surface area, enriched microporous structure, and nitrogen and oxygen-self-doping, the obtained carbon particles can not only provide abundant active sites for energy storage and rapid ion transport channels but also improve the utilization of S. Consequently, the S-cathode achieves an excellent cycle stability of 230 mAh g-1at a current density of 1 A g-1after 2000 cycles with a capacity retention of a94%. According to the kinetic analysis and density functional theory calculation, the unique and robust structure of carbon particles enables physical encapsulation and chemical confinement of S and polysulfides (PSs), which can strengthen Na+adsorption and diffusion. Therefore, this work established a universal technique for producing high-performance S-cathode materials, which may offer the potential for economical energy storage in RT Na-S batteries.",ACS Applied Energy Materials,10.1021/acsaem.2c02417
Metalized Polyacrylates as Efficient Binder for a Sulfurized Polyacrylonitrile/Polydopamine Active Material in Sulfur Cathodes for Room Temperature Sodium-Sulfur Batteries,"© 2022 American Chemical Society. All rights reserved.Promising binder systems with special chemical and mechanical functions are under extensive exploration to cope with serious volume change and harmful shuttle effect occurring during charge/discharge cycles of a sulfur cathode in sodium-sulfur (Na-S) batteries. In this aspect, sulfurized polyacrylonitrile (SPAN)/polydopamine (PDA) active materials are combined with different metalized polyacrylates (MPAAs) to result in a SPAN/PDA/MPAA binder system with peculiar morphology and superior mechanical and interfacial strengths. As the outer layer of SPAN/PDA/MPAA, MPAA can extend its long chains to interact with cathode components and, moreover, metal ions of MPAA can participate in the beneficial electron transport process. The results suggest that stability and electrochemical performance of the sulfur cathodes depend on the applied metal ions, which become better and better as the valence of metal ions change from mono (Na), di (Ca), and tri (Fe) to tetra (Ti). Cathode derived from SPAN/PDA/titanium polyacrylate (TiPAA) shows the best stability and electrochemical performance, exhibiting a rather high specific capacity of 1438 mAh g-1at 0.2 C for 100 cycles and 1271 mAh g-1at 1 C for 300 cycles. Hopefully, this study can provide a foundation on how to use different metal ions to manipulate the electrochemical performance of sulfur cathode in Na-S batteries.",ACS Applied Energy Materials,10.1021/acsaem.2c01836
Efficient Control of the Shuttle Effect in Sodium-Sulfur Batteries with Functionalized Nanoporous Graphenes,"© 2022 American Chemical Society. All rights reserved.Room-temperature sodium-sulfur batteries (RT-NaSBs) are the evolving candidates for large-scale stationary storage because of their major benefits including double-electron redox process and the natural abundance of sodium and sulfur resources. However, their practical applications have been hampered by the poor cycling stability due to the shuttle effect. This work aims at understanding the role of heteroatom-functionalized nanoporous graphene (NPG) in preventing the shuttle effect. The density functional theory method was used to unravel important properties associated with polysulfide-NPG interactions, including binding energy, electronic density of states, charge transfer mechanism, and dissociative energy barriers of the polysulfides. The findings reveal that oxygen- and nitrogen-functionalized NPG can effectively present the shuttle effect by chemically binding to sodium polysulfides (Na2Sn) with a binding energy stronger than that between Na2Snand the common electrolyte solvents. The chemical adsorption of Na2Snon the functionalized NPG causes a semiconductor-to-metal transition, benefiting the electrical conductivity. Moreover, the functionalized NPG lowers the Na2S dissociation energy to substantially form NaS and Na, which serves as a catalyst for enhancing the redox reactions between Na and S.",ACS Applied Nano Materials,10.1021/acsanm.2c02405
Covalent encapsulation of sulfur in a graphene/N-doped carbon host for enhanced sodium-sulfur batteries,"© 2022 Elsevier B.V.Application of emerging room temperature sodium-sulfur (RT Na-S) battery is restrained by the poor conductivity, volume expansion of sulfur cathode and the shuttle effect of soluble polysulfides in electrolytes. Herein, an N-doped two-dimensional (2D) carbon host was derived from the polydopamine coated graphene for sulfur storage. Different from the conventional used melt-diffusion method to integrate sulfur on graphene layer physically, we employed a vapor-infiltration method to realize the homogenous incorporation of sulfur in the graphene-based host via C-Sx-C bond. A polydopamine-derived N-doped carbon layer was further coated on graphene to confine the high-temperature-induced gas-phase sulfur, which effectively increase the covalently bonded sulfur content in the host. Moreover, based on Time-of-Flight Secondary Ion Mass Spectrometry (TOF-SIMS) measurement, the C-S bonds are mainly formed beside N-doped carbon, being well explained by the stronger interaction between N-doped carbon and S4 (sulfur vapor) than that of pure carbon from density functional theory (DFT) calculation results. When tested as a cathode for RT Na-S battery, the obtained N-doped graphene/sulfur cathode shows superior cycle stability.",Chemical Engineering Journal,10.1016/j.cej.2022.136257
Polydopamine as an interfacial layer to enhance mechanical and adhesive properties of the active materials in a sulfur cathode of sodium-sulfur batteries,"© 2022 The Author(s)Room temperature sodium-sulfur (Na-S) batteries are promising devices for energy storage system, but for practical applications volume expansion and detrimental shuttle effect of the sulfur cathode should be solved. Herein, we introduced a novel sulfur cathode system of using polydopamine (PDA) as an interlayer in between sulfurized polyacrylonitrile (SPAN) active material and pullulan-graft-sodium polyacrylic acid (PuA) binder. Active NH and OH functional groups of PDA interlayer serve as facile hydrogen bonding (H bonding) and/or chemical reaction sites to various functional groups of SPAN and PuA, thus forming an intimately packed SPAN/PDA/PuA composite with sufficient mechanical and interfacial adhesive strengths to survive from the dimensional variation of sulfur cathode during charge/discharge cycling. Moreover, various functional groups of the SPAN/PDA/PuA are capable of absorbing polysulfides to limit the shuttle effect. Sulfur cathode derived from SPAN/PDA/PuA exhibited a high specific capacity of 1340 mAh g−1 after 100 cycles at 0.2 C. Without the PDA interlayer, sulfur cathode derived from SPAN/PuA exhibits a much lower capacity of 790 mAh g−1. The role of PDA in promoting the stability and electrochemical performance of sulfur cathode is thus verified in this study.",Chemical Engineering Journal Advances,10.1016/j.ceja.2022.100352
Room-Temperature Sodium–Sulfur Batteries: Rules for Catalyst Selection and Electrode Design,"© 2022 Wiley-VCH GmbH.Seeking an optimal catalyst to accelerate conversion reaction kinetics of room-temperature sodium–sulfur (RT Na–S) batteries is crucial for improving their electrochemical performance and promoting the practical applications. Herein, theoretical calculations of interfacial interactions of catalysts and polysulfides in terms of the surface adsorption state, interfacial ions migration, and electronic concentration around the Fermi level are systematically proposed as guiding principles of catalyst selection for RT Na–S batteries. As a case, MoN catalyst is accurately selected from transition metal nitrides with different d orbital electrons, and for experiment, it is introduced into the carbon nanofibers as a dual-functioning host (MoN@CNFs). The MoN@CNFs can effectively anchor polysulfides and accelerate their conversion reaction. In addition, for the sodium anode, the MoN@CNFs can also induce uniform deposition of Na and inhibit dendrite growth, which are supported by in situ characterizations and finite element simulation technique. As a result, the as-prepared RT Na–S battery displays high reversible capacity of 990 mAh g–1 at 0.2 A g–1 after 100 cycles and long lifespan over 1500 cycles at 2 A g–1. Even with high S loading of 5 mg cm–2, the RT Na–S battery still exhibits a high areal capacity of 2.5 mAh cm–2.",Advanced Materials,10.1002/adma.202204214
Stable Cycling of Room-Temperature Sodium-Sulfur Batteries Based on an In Situ Crosslinked Gel Polymer Electrolyte,"© 2022 The Authors. Advanced Functional Materials published by Wiley-VCH GmbH.High-temperature sodium-sulfur battery (HT Na–S) technology has attracted substantial interest in the stationary energy storage sector due to its low cost and high energy density. However, the currently used solid electrolyte (ß-alumina) is expensive and can only be operated at high temperatures, which compromises safety. On the other hand, liquid electrolytes in room temperature sodium-sulfur batteries (RT Na–S) are susceptible to dendrite formation and polysulfide shuttle. Consequently, an electrolyte with both solid (shuttle blocking) and liquid (ionic conductivity) properties to overcome the above-mentioned issues is highly desired. Herein, a high-performance quasi-solid state crosslinked gel polymer electrolyte (GPE) prepared in situ using pentaerythritol triacrylate (PETA) exhibiting high ionic conductivity of 2.33 mS cm−1 at 25 °C is presented. The GPE-based electrolyte shows high stability resulting in a high discharge capacity of >600 mAh gs−1 after 2500 cycles with an average Coulombic efficiency of 99.91%. Density functional theory calculations reveal a weak interaction between the Na+ ions and the oxygen molecules of the PETA moiety, which leads to a facile cation movement. The crosslinked polymer network is tightly connected to the cathode and can confine sulfides, thereby facilitating the conversion process.",Advanced Functional Materials,10.1002/adfm.202201191
Rational Electrolyte Design toward Cyclability Remedy for Room-Temperature Sodium–Sulfur Batteries,"© 2022 Wiley-VCH GmbH.Rechargeable room-temperature sodium–sulfur (RT Na–S) batteries are a promising energy storage technology, owing to the merits of high energy density and low cost. However, their electrochemical performance has been severely hindered by the poor compatibility between the existing electrolytes and the electrodes. Here, we demonstrate that an all-fluorinated electrolyte, containing 2,2,2-trifluoro-N,N-dimethylacetamide (FDMA) solvent, 1,1,2,2-tetrafluoroethyl methyl ether (MTFE) anti-solvent and fluoroethylene carbonate (FEC) additive, can greatly enhance the reversibility and cyclability of RT Na–S batteries. A NaF- and Na3N-rich cathode electrolyte interphase derived from FDMA and FEC enables a “quasi-solid-phase” Na–S conversion, eliminating the shuttle of polysulfides. The MTFE not only reduces polysulfide dissolution, but also further stabilizes the Na anode via a tailored solvation structure. The as-developed RT Na–S batteries deliver a high capacity, long lifespan, and enhanced safety.",Angewandte Chemie - International Edition,10.1002/anie.202205416
