Multi-channel sulfurized polyacrylonitrile with hollow structure as cathode for room temperature sodium–sulfur batteries,"© 2021 Elsevier Inc.Sulfurized polyacrylonitrile (SPAN) has been comprehensively studied as a promising electrode material for sodium–sulfur batteries. However, problems such as low capacity and poor cycle stability still exist in room temperature sodium–sulfur batteries (RT-Na/S batteries). Here, a multi-channel sulfurized polyacrylonitrile (MSPAN) with hollow structure prepared by electrospinning technology was combined with polystyrene (PS) acting as a pore-forming agent, which not only provided a larger specific surface area and enlarged contact between electrode and electrolyte, but also limited the shuttling of polysulfides effectively, thereby improving the reversible specific capacity and rate performance of the electrodes. Through comparing the electrochemical performances of MSPAN on different current collectors, it was found that copper foil as the current collector favored the electrochemical performances of the materials. As a result, the MSPAN-2 used as the cathode for RT-Na/S batteries exhibited a high discharge specific capacity of 314.2 mAh g−1 at a current density of 2 ​A ​g−1. The fabrication of MSPAN provides a good example for improving the electrochemical performance of RT-Na/S batteries.",Journal of Solid State Chemistry,10.1016/j.jssc.2021.122359
Atomically dispersed S-Fe-N4 for fast kinetics sodium-sulfur batteries via a dual function mechanism,"© 2021 The AuthorsRoom-temperature sodium-sulfur batteries have significant potential for large-scale applications due to the low cost and high energy density of both sulfur and sodium. Nevertheless, the insulating nature of sulfur and the shuttle effect are impeding their practical application. Here we report that dispersed single-atom Fe sites anchored on a nitrogen-doped carbon matrix present an atomic-level strategy for the development of sulfur hosts. The electronic structure of sulfur is modified by the atomically dispersed Fe-N4 sites, which can transfer the electron to sulfur, thereby enhancing its reactivity. The S@Fe1-NMC cathode delivers a high reversible capacity of 1,650 mAh g−1 initially and 540 mAh g−1 after 500 cycles at 100 mA g−1. A dual function mechanism is observed on S-Fe-N4 sites, which can activate the polysulfides by weakening the S-S bonds and accelerate Na+ diffusion into Na-poor regions to engender a high driving force for Na2Sx decomposition, thus inhibiting the shuttle effect.",Cell Reports Physical Science,10.1016/j.xcrp.2021.100531
Electrochemical release of catalysts in nanoreactors for solid sulfur redox reactions in room-temperature sodium-sulfur batteries,"© 2021 The Author(s)Electrocatalysis-assisted entrapment of polysulfide while ensuring efficient nucleation of Na2S holds the key to addressing the shuttle effect and sluggish kinetics of polysulfide in room-temperature (RT) Na/S batteries. The constrained active sites, however, dramatically limit the efficiency of electrocatalysts. Here, a strategy of electrochemically releasing nano-silver catalytic sites during the discharge process is presented, visualized, and implemented for accelerated Na2S nucleation. Because of the effective polysulfide immobilization and accelerated Na2S nucleation, the sulfur cathode, supported by a self-released silver electrocatalyst, exhibits a superior reversible capacity of 701 mAh g−1 at 0.1 A g−1 and an ultra-stable cycling performance. Precise understanding of the electrochemically self-releasing mechanism and the catalysis in Na2S nucleation via in situ transmission electron microscopy (TEM) would aid, however, in fundamentally optimizing the working mechanism and for further development of more stable high-power RT Na/S batteries.",Cell Reports Physical Science,10.1016/j.xcrp.2021.100539
Mechanistic Insights into Interactions of Polysulfides at VS2Interfaces in Na-S Batteries: A DFT Study,"© Room temperature sodium-sulfur (Na-S) batteries, because of their high theoretical energy density and low cost, are considered as a promising candidate for next-generation energy storage devices. However, the practical utilization of the Na-S batteries is greatly hindered by various deleterious factors such as dissolution of sodium polysulfides (Na2Sn) into the electrolyte commonly termed as ""shuttle effect,""sluggish decomposition of solid Na2S, and poor electronic conductivity of sulfur. To overcome the challenges, we introduced single-layer vanadium disulfide (VS2) as an anchoring material (AM) to immobilize higher-order polysulfides from the dissolution and also to accelerate the otherwise sluggish kinetics of insoluble short-chain polysulfides. We employ density functional theory (DFT) calculations to elucidate the Na2Sn interactions at the VS2 interfaces. We show that the adsorption strengths of various Na2Sn species on the VS2 basal plane are adequate (1.21-4.3 eV) to suppress the shuttle effect, and the structure of Na2Sn are maintained without any decomposition, which is necessary to mitigate capacity fading. The calculated projected density of states (PDOS) reveals that the metallic character of the pristine VS2 is retained even after Na2Sn adsorption. The calculated Gibbs free energy of each elementary sulfur reduction reaction indicates a significant decrement in the free energy barrier due to the catalytic activity of the VS2 surface. Furthermore, VS2 is found to be an excellent catalyst to significantly reduce the oxidative decomposition barrier of Na2S, which facilitates accelerated electrode kinetics and higher utilization of sulfur. Overall, VS2 with strong adsorption behavior, enhanced electronic conductivity, and improved oxidative decomposition kinetics of polysulfides can be considered as an effective AM to prevent the shuttle effect and to improve the performance of Na-S batteries.",ACS Applied Materials and Interfaces,10.1021/acsami.1c10868
A Brief Overview of Room Temperature Na-S Batteries Using Composite Sulfur Cathode,"© 2021 Wiley-VCH GmbHThe research interests on sodium-sulfur (Na-S) batteries which have regained the worldwide attention from last few years. Na-S battery technology seems a good choice for future grid level stationary energy storage units where the cost is as important as the performance from practical applications point of view. This paper summarizes basic principle of operation, major benefits, and challenges of room temperature Na-S batteries using composite sulfur based cathodes. Few recent techniques employed by the research groups to develop composite sulfur cathodes for Na-S batteries are highlighted including the guidelines for upcoming Na-S batteries.",Macromolecular Symposia,10.1002/masy.201900206
Metal–Organic Frameworks-Derived Nitrogen-Doped Porous Carbon Nanocubes with Embedded Co Nanoparticles as Efficient Sulfur Immobilizers for Room Temperature Sodium–Sulfur Batteries,"© 2021 Wiley-VCH GmbHRoom temperature sodium–sulfur (RT Na–S) batteries are considered a promising candidate for energy-storage due to their high energy-density and low-cost. However, the shutting effect of polysulfides and sluggish kinetics of sulfur redox reactions still severely limit their practical implementation. Herein, a new type of 3D hierarchical porous carbonaceous nanocubes is reported as efficient sulfur hosts, composed of carbon nanotubes (CNT) and Co nanoparticles (NPs) uniformly embedded into a nitrogen-doped carbon matrix (NC). Because of the high specific surface area, large degree of graphitization, and the synergetic effects between Co NPs and N-doping, the as-designed CNTs/Co@NC electrodes not only significantly increase polysulfides immobilization, but also efficiently catalyze sulfur redox reactions, as confirmed by experimental results and DFT calculations. When tested in a RT Na–S battery, the S@CNTs/Co@NC-0.25 cathode demonstrates outstanding electrochemical performance, achieving high initial specific capacity of 1200.3 mAh g−1 at 0.1 C, remarkable rate capability up to 5.0 C (474.2 mAh g−1), and superior cyclic performance of 450.5 mAh g−1 (292 mAh g−1) after 400 cycles at 1.0 C (5.0 C). The integration of a 3D hierarchical porous architecture with well-dispersed Co NPs of an electro-catalyst provides valuable insights based on structure-adsorption-catalysis engineering for advanced RT Na–S batteries.",Small Methods,10.1002/smtd.202100455
Architecting Freestanding Sulfur Cathodes for Superior Room-Temperature Na–S Batteries,"© 2021 Wiley-VCH GmbHRoom-temperature sodium–sulfur (RT Na–S) batteries have attracted extensive attention because of their low cost and high specific energy. RT Na–S batteries, however, usually suffer from sluggish reaction kinetics, low reversible capacity, and short lifespans. Herein, it is shown that chain-mail catalysts, consisting of porous nitrogen doped carbon nanofibers (PCNFs) encapsulating Co nanoparticles (Co@PCNFs), can activate sulfur via electron engineering. The chain-mail catalysts Co@PCNFs with a micrograde hierarchical structure as a freestanding sulfur cathode (Co@PCNFs/S) can provide space for high mass loading of sulfur and polysulfides. The electrons can rapidly transfer from chain-mail catalysts to sulfur and polysulfides during discharge–charge processes, therefore boosting its conversion kinetics. As a result, this freestanding Co@PCNFs/S cathode achieves a high sulfur loading of 2.1 ± 0.2 mg cm−2, delivering a high reversible capacity of 398 mA h g−1 at 0.5 C (1 C = 1675 mA g−1) over 600 cycles and superior rate capability of an average capacity of 240 mA h g−1 at 5 C. Experimental results, combined with density functional theory calculations, demonstrate that the Co@PCNFs/S can efficiently improve the conversion kinetics between the polysulfides and Na2S via transferring electrons from Co to them, thereby realizing efficient sulfur redox reactions.",Advanced Functional Materials,10.1002/adfm.202102280
A novel one-step reaction sodium-sulfur battery with high areal sulfur loading on hierarchical porous carbon fiber,"© 2020 The Authors. Carbon Energy published by Wenzhou University and John Wiley & Sons Australia, LtdRoom temperature sodium-sulfur (RT Na-S) batteries are gaining extensive attention as attractive alternatives for large-scale energy storage, due to low cost and high abundancy of sodium and sulfur in nature. However, the dilemmas regarding soluble polysulfides (Na2Sn, 4 ≤ n ≤ 8) and the inferior reaction kinetics limit their practical application. To address these issues, we report the activated porous carbon fibers (APCF) with small sulfur molecules (S2–4) confined in ultramicropores, to achieve a reversible single-step reaction in RT Na-S batteries. The mechanism is investigated by the in situ UV/vis spectroscopy, which demonstrates Na2S is the only product during the whole discharge process. Moreover, the hierarchical carbon structure can enhance areal sulfur loading without sacrificing the capacity due to thorough contact between electrolyte and sulfur electrode. As a consequence, the APCF electrode with 38 wt% sulfur (APCF-38S) delivers a high initial reversible specific capacity of 1412 mAh g−1 and 10.6 mAh cm−2 (avg. areal sulfur loading: 7.5 mg cm−2) at 0.1 C (1 C = 1675 mA g−1), revealing high degree of sulfur utilization. This study provides a new strategy for the development of high areal capacity RT Na-S batteries.",Carbon Energy,10.1002/cey2.86
Hydrothermal synthesis of MoS2/rGO composite as sulfur hosts for room temperature sodium-sulfur batteries and its electrochemical properties,"© 2021 Elsevier LtdThe room temperature sodium-sulfur batteries are an attraction to worldwide industrial and academic as a next-generation energy storage system due to the high energy density, theoretical capacity, and cheap cost of sulfur. However, the practical application is being overdue by fast decay, poor conductivity, and the shuttle effect attributed to the low coulombic efficiency. The present study focuses on preparing MoS2/rGO/S cathode material to overcome the disadvantages of room temperature sodium-sulfur (RT-NaS) batteries. We used hydrothermal method to prepare MoS2, rGO, and MoS2/rGO composite and the sulfur was infused by the melt diffusion. The MoS2/rGO/S composite shows a high reversible capacity of 190 mAh/g after 1000 cycles at a 2 C-rate. The flower-like MoS2/rGO/S composite increases the conductivity and buffers the volume expansion during cycling.",Journal of Energy Storage,10.1016/j.est.2021.102660
Tunable Nitrogen-Doping of Sulfur Host Nanostructures for Stable and Shuttle-Free Room-Temperature Sodium-Sulfur Batteries,"© 2021 American Chemical Society.Room-temperature sodium-sulfur batteries have potential in stationary applications, but challenges such as loss of active sulfur and low electrical conductivity must be solved. Nitrogen-doped nanocarbon host cathodes have been employed in metal-sulfur batteries: polar interactions mitigate the loss of sulfur, while the conductive nanostructure addresses the low conductivity. Nevertheless, these two properties run contrary to each other as greater nitrogen-doping of nanocarbon hosts is associated with lower conductivity. Herein, we investigate the polarity-conductivity dilemma to determine which of these properties have the stronger influence on cycling performance. Lower carbonization temperatures produce more pyridinic nitrogen and pyrrolic nitrogen, which from density functional theory calculations preferentially bind discharge products (Na2S and short-chain polysulfides). Despite its lower conductivity, the highly doped composite showed better Coulombic efficiency and stability, retaining a high capacity of 980 mAh g(S)-1 after 800 cycles. Our findings represent a paradigm shift where nitrogen-doping should be prioritized in designing shuttle-free, long-life sodium-sulfur batteries.",Nano Letters,10.1021/acs.nanolett.1c01763
Yolk@Shell Structured MnS@Nitrogen-Doped Carbon as a Sulfur Host and Polysulfide Conversion Booster for Lithium/Sodium Sulfur Batteries,"© Lithium-sulfur (Li-S) batteries have been regarded as an important candidate for next-generation energy storage devices due to their low cost and high theoretical energy density. However, several factors retard the practical use of Li-S batteries including the slow kinetics of lithium polysulfide (LiPS) transformation as well as the shuttle effect induced by the diffusion of LiPS that damages the cycling stability of Li-S batteries. In this study, a yolk@shell structured MnS@nitrogen-doped carbon (MnS@N-C) is developed as the S host and polysulfide conversion booster, which offers both the physical confinement of S species and accelerated kinetics toward LiPS catalytic conversion. As a result, the developed S/yolk@shell MnS@N-C delivers a higher rate performance compared to S/yolk@shell MnO@N-C and S/N-C and long cycle life with a remaining capacity of 636.1 mAh g-1 after 330 cycles at 0.5C. When equipped with MnS@N-C functional separators, S/yolk@shell MnS@N-C retains a capacity of 504.2 mAh g-1 after 1000 cycles at 1C. In addition, S/yolk@shell MnS@N-C also delivers a decent capacity decay of 0.16% per cycle after 300 cycles at 0.5C in a room-temperature Na-S battery.",ACS Applied Energy Materials,10.1021/acsaem.0c03235
Sulfur in Amorphous Silica for an Advanced Room-Temperature Sodium–Sulfur Battery,"© 2020 Wiley-VCH GmbHThe room-temperature (RT) Na/S battery is a promising energy storage system owing to suitable operating temperature, high theoretical energy density, and low cost. However, it has a poor cycle life and low reversible capacity. In this work, we report a long-life RT-Na/S battery with amorphous porous silica as a sulfur host. The sulfur is loaded into amorphous silica by a dipping method; the optimal sulfur loading is up to 73.48 wt %. Molecular dynamics simulation and first-principles calculations suggest that the complex pores, acting as micro-containers and the formation of Na-O chemical bonds between amorphous silica and sodium polysulfide, give the electrodes a strong ability to inhibit sodium polysulfide shuttle. This would give rise to effectively avoiding the loss of active sulfur, corresponding to a superior capacity and an excellent cyclability even at 10 A gsulfur−1 (nearly 100 % coulomb efficiency and high reversible capacity of 955.8 mAh gsulfur−1 after 1460 cycles).",Angewandte Chemie - International Edition,10.1002/anie.202015932
MOF-Derived CoS2/N-Doped Carbon Composite to Induce Short-Chain Sulfur Molecule Generation for Enhanced Sodium-Sulfur Battery Performance,"© 2021 American Chemical Society.Dissolution of intermediate sodium polysulfides (Na2Sx; 4≤x≤8) is a crucial obstacle for the development of room-temperature sodium-sulfur (Na-S) batteries. One promising strategy to avoid this issue is to load short-chain sulfur (S2-4), which could prohibit the generation of soluble polysulfides during the sodiation process. Herein, unlike in the previous reported cases where short-chain sulfur was stored by confinement within a small-pore-size (≤0.5 nm) carbon host, we report a new strategy to generate short-chain sulfur in larger pores (>0.5 nm) by the synergistic catalytic effect of CoS2 and appropriate pore size. Based on density functional theory calculations, we predict that CoS2 can serve as a catalyst to weaken the S-S bond in the S8 ring structure, facilitating the formation of short-chain sulfur molecules. By experimentally tuning the pore size of the CoS2-based hosts and comparing their performances as cathodes in Na-S and Li-S batteries, we conclude that such a catalytic effect depends on the proximity of sulfur to CoS2. This avoids the generation of soluble polysulfides and results in superior electrochemical properties of the composite materials introduced here for Na-S batteries. As a result, the optimized CoS2/N-doped carbon/S electrode showed excellent electrochemical performance with high reversible specific capacities of 488 mA h g-1 (962 mA h g(s)-1) after 100 cycles (0.1 A g-1) and 403 mA h g-1 after 1000 cycles (1 A g-1) with a superior rate performance (262 mA h g-1 at 5.0 A g-1).",ACS Applied Materials and Interfaces,10.1021/acsami.1c02301
Tunable Electrocatalytic Behavior of Sodiated MoS2 Active Sites toward Efficient Sulfur Redox Reactions in Room-Temperature Na–S Batteries,"© 2021 Wiley-VCH GmbHRoom-temperature (RT) sodium–sulfur (Na–S) batteries hold great promise for large-scale energy storage due to the advantages of high energy density, low cost, and resource abundance. The research progress on RT Na–S batteries, however, has been greatly hindered by the sluggish kinetics of the sulfur redox reactions. Herein, an elaborate multifunctional architecture, consisting of N-doped carbon skeletons and tunable MoS2 sulfiphilic sites, is fabricated via a simple one-pot reaction followed by in situ sulfurization. Beyond the physical confinement and chemical binding of polarized N-doped carbonaceous microflowers, the MoS2 active sites play a key role in catalyzing polysulfide redox reactions, especially the conversion from long-chain Na2Sn (4 ≤ n ≤ 8) to short-chain Na2S2 and Na2S. Significantly, the electrocatalytic activity of MoS2 can be tunable via adjusting the discharge depth. It is remarkable that the sodiated MoS2 exhibits much stronger binding energy and electrocatalytic behavior compared to MoS2 sites, effectively enhancing the formation of the final Na2S product. Consequently, the S cathode achieves superior electrochemical performance in RT Na–S batteries, delivering a high capacity of 774.2 mAh g−1 after 800 cycles at 0.2 A g−1, and an ultrahigh capacity retention with a capacity decay rate of only 0.0055% per cycle over 2800 cycles.",Advanced Materials,10.1002/adma.202100229
High-Capacity and Stable Sodium-Sulfur Battery Enabled by Confined Electrocatalytic Polysulfides Full Conversion,"© 2021 Wiley-VCH GmbHThe efficient polysulfide capture and reversible sulfur recovery during reverse charging process are critical to exploiting the full potential of room temperature Na-S batteries. Here, based on a core-shell design strategy, the structural and chemical synergistic manipulation of sodium polysulfides quasi-solid-state reversible conversion is proposed. The sulfur is encapsulated in the multi-pores of 3D interconnected carbon fiber as the core structure. The Fe(CN)64−-doped polypyrrole film serves as a redox-active polar shell to lock up polysulfides and promote complete polysulfide conversion. Importantly, the short-chain Na2S4 polysulfides are reduced to Na2S directly leaving with a small fraction of soluble intermediates as the cation-transfer medium at the core/shell interface, and freeing up formation of solid Na2S2 incomplete product. Further, the redox mediator with open Fe species electrocatalytically lowers the Na2S oxidation energy barrier and renders the high reversibility of electrodeposited Na2S. The tunable quasi-solid-state reversible sulfur conversion under versatile polymer sheath greatly enhances sulfur utilization, affording a remarkable capacity of 1071 mAh g−1 and a stable high capacity of 700 mAh g−1 at 200 mA g−1 after 200 cycles. The confined electrocatalytic effect provides a strategy for tuning electrochemical pathway of sulfur species and guarantees high-efficiency sulfur electrochemistry.",Advanced Functional Materials,10.1002/adfm.202100666
Enabling a Stable Room-Temperature Sodium-Sulfur Battery Cathode by Building Heterostructures in Multichannel Carbon Fibers,"© Roomerature sodium-sulfur (RT Na-S) batteries are widely considered as one of the alternative energy-storage systems with low cost and high energy density. However, the both poor cycle stability and capacity are two critical issues arising from low conversion kinetics and sodium polysulfides (NaPSs) dissolution for sulfur cathodes during the charge/discharge process. Herein, we report a highly stable RT Na-S battery cathode via building heterostructures in multichannel carbon fibers. The TiN-TiO2@MCCFs, fabricated by electrospinning and nitriding techniques, are loaded with the active material S, forming S/TiN-TiO2@MCCFs as the cathode in a RT Na-S battery. At 0.1 A g-1, the cathode produces the capacity of more than 640 mAh g-1 within 100 cycles with a high Coulombic efficiency of nearly 100%. Even at 5 A g-1, the battery still exhibites a capacity of 257.1 mAh g-1 after 1000 cycles. Combining structural and electrochemical analyses with the first-principles calculations reveals that the incorporation of the highly electrocatalytic activity of TiN with the powerful chemisorption of TiO2 well stabilizes S and also alleviates the shuttle effects of polysulfides. This work with simple processes and low cost is expected to promote the further development and application of metal-S batteries.",ACS Nano,10.1021/acsnano.1c00804
Multi-step Controllable Catalysis Method for the Defense of Sodium Polysulfide Dissolution in Room-Temperature Na-S Batteries,"© 2021 American Chemical Society.Room-temperature (RT) sodium-sulfur batteries hold great promise for the development of efficient, low-cost, and environmentally friendly energy storage systems. Nevertheless, the dissolution of long-chain polysulfides is a huge obstacle. In this work, a composite cathode which integrates Ni/Co bimetal nanoparticles as the catalyst and carbon spheres with abundant channels as the host is prepared for RT Na-S batteries. Moreover, a valuable strategy to reduce the dissolution of polysulfides by accurately regulating the two-step reaction kinetics of polysulfide transformation (from Na2S to long-chain polysulfides and then from polysulfides to sulfur) is presented. Through adjusting the ratio of Ni and Co, the optimal cathode with a Ni/Co ratio of 1:2 can retard the first conversion of Na2S to polysulfides and simultaneously accelerate the subsequent transformation of polysulfides to sulfur. In this case, the soluble polysulfides can immediately transform to solid sulfur as soon as it appears, thus avoiding the shuttle of polysulfides. The galvanostatic intermittent titration method and in situ Raman are employed to supervise the transformation of polysulfides during the discharge/charge process. As a result, the composite shows excellent performance as the cathode of RT liquid/quasi-solid-state Na-S batteries in terms of specific capacities, rate capability, and cycle stability.",ACS Applied Materials and Interfaces,10.1021/acsami.0c21267
